{
    "schema":  "python-slm-phase-evidence-v2",
    "phase_id":  "P1B",
    "run_id":  "20260811T163253540Z-8624ac3c88b04652a94fd8ee",
    "mode":  "Cuda",
    "status":  "FAIL",
    "started_at":  "2026-08-11T16:32:53.4745140Z",
    "finished_at":  "2026-08-11T16:32:58.2659451Z",
    "duration_ms":  4791,
    "invocation":  {
                       "argv":  [
                                    "powershell",
                                    "-NoProfile",
                                    "-ExecutionPolicy",
                                    "Bypass",
                                    "-File",
                                    "scripts/verify-env.ps1",
                                    "-Mode",
                                    "Cuda",
                                    "-OutputRoot",
                                    "docs/receipts/P1B"
                                ],
                       "cwd":  "${REPO}"
                   },
    "source_identity_sha256":  "364e5a308986eb2e1d569c12548d92c870e900af170cc0ae376a76f0fbc4cae8",
    "p0_dependency":  {
                          "status":  "FAIL",
                          "receipt_commit":  "86fb1e4cc68efeb651e5362c4aca85c2827d8e4d",
                          "receipt_sha256":  "f08c6a41658ff287e238d6a96c4f2c874975964202c3eeced2bc0bc21f308904",
                          "contract_sha256":  "fc2c60b52fdd7c524e0da06bb03972a4d523c21ad5536cba536185435bd44ad4",
                          "decision_ledger_sha256":  "8349d8a3e06d96d6921889de5534715e7b2f7439caf7e06558a97652a8890c8d"
                      },
    "p1a_dependency":  {
                           "status":  "NOT_RUN",
                           "pointer_path":  null,
                           "pointer_sha256":  null,
                           "acceptance_path":  null,
                           "acceptance_sha256":  null,
                           "acceptance_sequence":  null,
                           "run_path":  null,
                           "run_evidence_sha256":  null,
                           "seal_path":  null,
                           "seal_sha256":  null,
                           "environment_path":  null,
                           "environment_sha256":  null,
                           "source_identity_sha256":  null,
                           "verifier_sha256":  null,
                           "schema_bundle_sha256":  null,
                           "review_closure_commit":  null
                       },
    "environment":  null,
    "commands":  [

                 ],
    "gates":  {
                  "p0":  {
                             "status":  "FAIL",
                             "detail":  "absolute path remained after redaction for command C01"
                         },
                  "p1a":  {
                              "status":  "NOT_RUN",
                              "detail":  "not reached"
                          },
                  "cpu_regression":  {
                                         "status":  "NOT_RUN",
                                         "detail":  "not reached"
                                     },
                  "input_stability":  {
                                          "status":  "PASS",
                                          "detail":  "inputs, target, repository, Cargo.lock, and parent environment remained stable"
                                      },
                  "toolchain":  {
                                    "status":  "NOT_RUN",
                                    "detail":  "not reached"
                                },
                  "cuda_toolkit":  {
                                       "status":  "NOT_RUN",
                                       "detail":  "not reached"
                                   },
                  "architecture_targets":  {
                                               "status":  "NOT_RUN",
                                               "detail":  "not reached"
                                           },
                  "gpu_identity":  {
                                       "status":  "NOT_RUN",
                                       "detail":  "not reached"
                                   },
                  "driver_runtime":  {
                                         "status":  "NOT_RUN",
                                         "detail":  "not reached"
                                     },
                  "device_probe":  {
                                       "status":  "NOT_RUN",
                                       "detail":  "not reached"
                                   },
                  "python_isolation":  {
                                           "status":  "NOT_RUN",
                                           "detail":  "not reached"
                                       },
                  "redaction":  {
                                    "status":  "PASS",
                                    "detail":  "failed-run receipts contain no prohibited machine, user, credential, or secret values"
                                },
                  "cleanup":  {
                                  "status":  "PASS",
                                  "detail":  "verifier-owned temporary root was removed"
                              }
              },
    "errors":  [
                   {
                       "code":  "UNEXPECTED_VERIFIER_FAILURE",
                       "category":  3,
                       "message":  "absolute path remained after redaction for command C01",
                       "remediation":  "Correct the reported CUDA environment prerequisite, then rerun the exact P1B command."
                   }
               ],
    "cleanup":  {
                    "attempted":  true,
                    "temporary_root_removed":  true
                },
    "seal":  {
                 "path":  "SHA256SUMS",
                 "entries":  8,
                 "coverage_rule":  "all_run_files_except_seal"
             }
}
